<?xml version="1.0" encoding="UTF-8"?>
<PSAPData xmlns:xsi="http://www.w3.org/2001/XMLSchema-instance" xsi:noNamespaceSchemaLocation="PSAPData.xsd">
  <psap>
    <eventId>eventId</eventId>
    <type>police</type>
    <name>name</name>
    <description>description</description>
    <position>
      <latitude>latitude</latitude>
      <longitude>longitude</longitude>
    </position>
    <emailAddress>
      <emailAddress>emailAddress</emailAddress>
      <emailAddress>emailAddress</emailAddress>
      <emailAddress>emailAddress</emailAddress>
    </emailAddress>
    <phoneNumbers>
      <primaryPhoneNumber>primaryPhoneNumber</primaryPhoneNumber>
      <primarySIPLink>primarySIPLink</primarySIPLink>
      <secondaryPhoneNumber>secondaryPhoneNumber</secondaryPhoneNumber>
      <secondarySIPLink>secondarySIPLink</secondarySIPLink>
    </phoneNumbers>
  </psap>
  <psap>
    <eventId>eventId</eventId>
    <type>police</type>
    <name>name</name>
    <description>description</description>
    <position>
      <latitude>latitude</latitude>
      <longitude>longitude</longitude>
    </position>
    <emailAddress>
      <emailAddress>emailAddress</emailAddress>
      <emailAddress>emailAddress</emailAddress>
      <emailAddress>emailAddress</emailAddress>
    </emailAddress>
    <phoneNumbers>
      <primaryPhoneNumber>primaryPhoneNumber</primaryPhoneNumber>
      <primarySIPLink>primarySIPLink</primarySIPLink>
      <secondaryPhoneNumber>secondaryPhoneNumber</secondaryPhoneNumber>
      <secondarySIPLink>secondarySIPLink</secondarySIPLink>
    </phoneNumbers>
  </psap>
  <psap>
    <eventId>eventId</eventId>
    <type>police</type>
    <name>name</name>
    <description>description</description>
    <position>
      <latitude>latitude</latitude>
      <longitude>longitude</longitude>
    </position>
    <emailAddress>
      <emailAddress>emailAddress</emailAddress>
      <emailAddress>emailAddress</emailAddress>
      <emailAddress>emailAddress</emailAddress>
    </emailAddress>
    <phoneNumbers>
      <primaryPhoneNumber>primaryPhoneNumber</primaryPhoneNumber>
      <primarySIPLink>primarySIPLink</primarySIPLink>
      <secondaryPhoneNumber>secondaryPhoneNumber</secondaryPhoneNumber>
      <secondarySIPLink>secondarySIPLink</secondarySIPLink>
    </phoneNumbers>
  </psap>
</PSAPData>
